P3Z;Administrateur / Administratrice judiciaire,Assistant / Assistante de cabinet juridique,Assistant / Assistante de justice,Assistant / Assistante de service juridique,Assistant notarial / Assistante notariale,Auxiliaire juridique,Avocat général / Avocate générale,Clerc,Clerc assermenté,Clerc aux formalités,Clerc aux formalités de notaire,Clerc d'avocat,Clerc de commissaire-priseur,Clerc de notaire,Clerc d'huissier,Clerc formaliste,Clerc hors rang,Clerc hors rang de notaire,Clerc rédacteur,Clerc significateur,Clerc significateur assermenté d'huissier,Collaborateur d'huissier chargé / Collaboratrice d'huissier chargée de recouvrement,Commissaire à la Cour des comptes,Commissaire-priseur / Commissaire-priseure,Commissaire-priseur / Commissaire-priseuse judiciaire,Conciliateur / Conciliatrice de justice,Conseiller / Conseillère à la Cour de cassation,Conseiller / Conseillère à la Cour des comptes,Conseiller / Conseillère au tribunal administratif,Greffier / Greffière,Greffier / Greffière en chef,Huissier / Huissière de justice,Huissier / Huissière du trésor public,Juge,Juge d'application des peines,Juge de grande instance,Juge de police,Juge de proximité,Juge des affaires familiales,Juge des enfants,Juge des libertés et de la détention,Juge des référés,Juge d'instance,Juge d'instruction,Magistrat / Magistrate,Magistrat / Magistrate de liaison,Mandataire de justice,Mandataire liquidateur / liquidatrice,Médiateur / Médiatrice judiciaire,Médiateur / Médiatrice pénal,Notaire,Premier clerc,Premier clerc d'avocat,Président / Présidente du tribunal administratif,Président / Présidente du tribunal de commerce,Président / Présidente du tribunal de grande instance,Principal clerc,Principal clerc adjoint,Principal clerc adjoint de notaire,Principal clerc d'avocat,Principal clerc de commissaire-priseur,Principal clerc de notaire,Principal clerc d'huissier,Procureur / Procureure de la République,Procureur général / Procureure générale,Sous-principal clerc d'avocat,Sous-principal clerc de notaire,Substitut / Substitute du Procureur de la République,Substitut général / Substitute générale,Vice procureur / Vice procureure de la République,Formaliste
P4Z;Adjoint / Adjointe de sécurité de la police nationale,Agent / Agente de constatation des douanes branche surveillance,Agent / Agente de la surveillance spécialisée de la commune,Agent / Agente de police municipale,Agent / Agente de stationnement de la voirie,Agent / Agente de surveillance de stationnement payant,Agent / Agente de surveillance des parcs et jardins,Agent / Agente de surveillance des voies publiques,Agent / Agente motocycliste de la douane,Aide-tireur / Aide-tireuse canon,Artificier démineur / Artificière démineuse,Brigadier / Brigadière,Brigadier / Brigadière de police municipale,Brigadier-chef / Brigadière-chef de police municipale,Cadet de la police nationale,Capitaine de police,Cavalier porté / Cavalière portée,Chargé / Chargée de la défense civile et économique,Chargé / Chargée de sécurité intérieure et d'ordre public,Chargé / Chargée de sécurité routière,Chef d'agrées,Chef de Bureau Opération - instruction,Chef de cellule d'intervention -NBC- Nucléaire, Bactériologique et Chimique,Chef de cellule d'intervention risques technologiques - naturels,Chef de centre de secours,Chef de centre d'incendie et de secours,Chef de char,Chef de colonne de secours,Chef de corps,Chef de garde,Chef de groupe combattant / combattante,Chef de groupement de secours,Chef de patrouille combattant / combattante,Chef de peloton de combat,Chef de pièce d'artillerie,Chef de police municipale,Chef de section de combat,Chef de section d'intervention sécurité civile,Chef de service de police municipale,Chef de service pénitentiaire,Chef de site en incendie et secours,Chef d'engin blindé,Chef d'équipe combat,Chef d'équipe de secours,Chef du service de sécurité des pistes,Combattant / Combattante toutes armes -TTA-,Commandant / Commandante de bataillon,Commandant / Commandante de compagnie de combat,Commandant / Commandante de police,Commandant / Commandante d'unité de combat,Commissaire de police,Commissaire divisionnaire de police,Commissaire principal / principale de police,Conducteur / Conductrice de véhicule de combat,Conducteur / Conductrice d'engins d'extinction d'incendie,Conducteur / Conductrice d'engin spécial d'incendie,Contrôleur / Contrôleuse des douanes branche surveillance,Contrôleur général / Contrôleuse générale de la police nationale,Démineur / Démineuse sécurité civile,Électromécanicien / Électromécanicienne de sécurité,Électromécanicien / Électromécanicienne de systèmes d'armes missiles,Électromécanicien / Électromécanicienne de systèmes d'armes sous-marines,Électronicien / Électronicienne d'armes,Électronicien / Électronicienne systèmes d'armes,Engagé / Engagée Volontaire de l'Armée de Terre -EVAT-,Engagé Volontaire -EV- combattant / Engagée Volontaire -EV- combattante,Enquêteur / Enquêtrice de police,Équipier / Équipière commando,Équipier sapeur-pompier / Équipière sapeuse-pompière,Équipier / Équipière sécurité civile,Fusilier / Fusilière commando,Fusilier-marin / Fusilière-marin,Garde champêtre,Garde républicain / républicaine,Gardien / Gardienne de cimetière municipal,Gardien / Gardienne de compagnie républicaine de sécurité,Gardien / Gardienne de la paix,Gardien / Gardienne des parcs et jardins,Gardien principal / Gardienne principale de police municipale,Gendarme,Gendarme adjoint / adjointe,Gendarme mobile,Grenadier voltigeur / Grenadière voltigeuse,Homme / Femme d'équipage d'engin blindé,Inspecteur / Inspectrice de sécurité de la commune,Inspecteur / Inspectrice des douanes branche surveillance,Intervenant / Intervenante de sécurité civile et de secours,Légionnaire,Lieutenant / Lieutenante de police,Lieutenant sapeur-pompier / Lieutenante sapeuse-pompière,Maître-chien / Maîtresse-chien d'avalanche,Maître-chien / Maîtresse-chien de la gendarmerie,Maître-chien / Maîtresse-chien sécurité civile,Marin-pompier,Mécanicien / Mécanicienne de systèmes d'armes,Militaire du rang combattant / combattante,Missilier / Missilière armes sous-marines,Missilier / Missilière artillerie,Motard / Motarde de la police nationale,Motocycliste de la gendarmerie,Officier / Officière commandement opérationnel de l'armée de l'air,Officier / Officière commandement opérationnel de l'armée de terre,Officier / Officière de gendarmerie,Officier / Officière de police,Officier / Officière de police judiciaire,Officier / Officière des armes,Officier / Officière des bases de l'air,Officier / Officière d'État-Major,Officier / Officière marine nationale,Officier marinier combattant / Officière marinière combattante,Officier marin-pompier / Officière marin-pompière,Officier observateur / Officière observatrice,Officier pompier / Officière pompière,Officier / Officière reconnaissance,Officier sapeur-pompier / Officière sapeuse-pompière,Officier / Officière spécialiste de sécurité civile,Opérateur / Opératrice conduite de tir/tourelle,Opérateur / Opératrice de défense sol-air,Opérateur / Opératrice de vidéoprotection de police municipale,Parachutiste militaire,Pilote d'engin blindé,Pisteur / Pisteuse secouriste,Policier municipal / Policière municipale,Pompier / Pompière,Pompier industriel / Pompière industrielle,Pompier technicien / Pompière technicienne de l'air,Pourvoyeur / Pourvoyeuse d'arme,Premier surveillant / Première surveillante pénitentiaire,Pupitreur tireur / Pupitreuse tireuse,Radio chargeur / chargeuse,Responsable de sécurité civile et de secours,Responsable de sécurité publique,Responsable opérationnel / opérationnelle de la défense,Responsable sécurité des pistes,Sapeur / Sapeuse de combat,Sapeur-pompier / Sapeuse-pompière,Secouriste,Secouriste brancardier / brancardière,Servant / Servante d'arme,Soldat / Soldate,Sous-officier combattant / Sous-officière combattante,Sous-officier / Sous-officière de gendarmerie,Spécialiste sécurité civile,Spéléologue secouriste,Stationnaire,Surveillant / Surveillante pénitentiaire,Technicien / Technicienne de la prévention et de lutte contre les sinistres,Technicien / Technicienne de recherche et d'identification criminelle,Technicien / Technicienne en investigation criminelle,Technicien / Technicienne en sécurité incendie et secourisme,Tireur d'avalancheur / Tireuse d'avalancheur,Tireur / Tireuse canon,Tireur / Tireuse d'engin blindé,Placier régisseur / Placière régisseuse de marché,Technicien électronicien / Technicienne électronicienne de systèmes d'armes spécialiste des opérations des forces navales et sous-marines,Officier / Officière commando,Agent / Agente de traversée des écoles
Q0Z;Agent administratif / Agente administrative back-office marché,Agent administratif / Agente administrative d'assurances,Agent administratif / Agente administrative de banque,Agent administratif / Agente administrative des opérations bancaires,Agent administratif / Agente administrative middle-office marché,Agent commercial / Agente commerciale en assurances,Agent / Agente technique de banque,Agent / Agente technique des régimes de retraite complémentaire et de prévoyance,Aide-rédacteur / Aide-rédactrice d'assurances,Assistant administratif / Assistante administrative d'assurances,Assistant / Assistante de clientèle de banque,Assistant / Assistante service clientèle de banque,Assistant / Assistante service clientèle bancaire,Attaché / Attachée de clientèle de banque,Attaché / Attachée de clientèle en assurances,Caissier / Caissière de bureau de change,Chargé / Chargée d'accueil en banque,Chargé / Chargée d'accueil et de services clientèle bancaire,Chargé / Chargée de clientèle bancaire,Chargé / Chargée de clientèle centre d'appels en assurances,Chargé / Chargée de clientèle commerciale de banque,Chargé / Chargée de clientèle de banque,Chargé / Chargée de clientèle en assurances,Chargé / Chargée de clientèle entreprises de banque,Chargé / Chargée de clientèle particuliers de banque,Chargé / Chargée de clientèle professionnelle de banque,Chargé / Chargée de gestion bancaire,Chargé / Chargée de relations clientèle bancaire,Collaborateur commercial / Collaboratrice commerciale en assurances,Conseiller / Conseillère accueil en agence bancaire,Conseiller / Conseillère clientèle en assurances,Conseiller commercial / Conseillère commerciale en assurances,Conseiller commercial professionnel / Conseillère commerciale professionnelle secteur bancaire,Conseiller / Conseillère d'accueil en banque,Conseiller / Conseillère de clientèle bancaire,Conseiller / Conseillère en assurances,Conseiller / Conseillère en assurance produits d'épargne,Conseiller / Conseillère en assurance vie,Conseiller / Conseillère en produit épargne,Conseiller financier / Conseillère financière banque postale,Conseiller financier / Conseillère financière clientèle professionnelle,Conseiller / Conseillère gestion sinistres,Conseiller / Conseillère Incendie, Accidents, Risques Divers -IARD-,Conseiller / Conseillère mutualiste,Conseiller / Conseillère mutualiste Incendie, Accidents, Risques Divers -IARD-,Conseiller / Conseillère prévoyance santé,Décompteur / Décompteuse de prestations,Employé central / Employée centrale chèque,Gestionnaire compte entreprise en assurances,Gestionnaire cotisations en assurances,Gestionnaire de clientèle bancaire,Gestionnaire de compte retraite en assurances,Gestionnaire en assurances,Gestionnaire liquidation retraite,Gestionnaire prestations en assurances,Gestionnaire santé en assurances,Gestionnaire sinistre Incendie, Accidents, Risques Divers -IARD-,Guichetier / Guichetière accueil banque,Guichetier / Guichetière de banque,Guichetier / Guichetière de la banque postale,Guichetier payeur / Guichetière payeuse,Guichetier vendeur / Guichetière vendeuse,Liquidateur / Liquidatrice de prestations,Producteur / Productrice en assurances,Rédacteur / Rédactrice d'assurances,Rédacteur polyvalent / Rédactrice polyvalente production sinistres,Rédacteur / Rédactrice production auto,Rédacteur / Rédactrice production Incendie Risques Industriels (IRI),Rédacteur / Rédactrice production risques complexes,Rédacteur / Rédactrice production risques de particuliers,Rédacteur / Rédactrice production Risques Divers (RD),Rédacteur / Rédactrice production risques simples,Rédacteur / Rédactrice production vie,Rédacteur / Rédactrice règlement assurances,Rédacteur / Rédactrice règlement automatique,Rédacteur / Rédactrice règlement contentieux,Rédacteur / Rédactrice règlement corporel,Rédacteur / Rédactrice règlement incendie dommage,Rédacteur / Rédactrice règlement matériel auto,Rédacteur / Rédactrice règlement responsabilité civile,Rédacteur / Rédactrice sinistre auto,Rédacteur / Rédactrice sinistre incendie,Rédacteur / Rédactrice sinistres,Rédacteur / Rédactrice sinistres complexes,Rédacteur / Rédactrice sinistres contentieux,Rédacteur / Rédactrice sinistres risques divers,Rédacteur / Rédactrice sinistres simples,Technicien administratif / Technicienne administrative de banque,Technicien / Technicienne de gestion électronique de documents -GED-,Technico-commercial / Technico-commerciale en assurances,Téléconseiller / Téléconseillère en assurances,Téléconseiller / Téléconseillère en banque,Chargé / Chargée de clientèle rachat de crédits,Gestionnaire de prestations assurance maladie,Gestionnaire de comptes cotisants,Gestionnaire de prestations sociales,Agent / Agente d'accueil de prestations sociales,Conseiller / Conseillère en crédit immobilier,Courtier / Courtière en prêts immobiliers
Q1Z;Actuaire,Agent commercial / Agente commerciale en assurances,Agent / Agente de back-office,Agent / Agente de middle-office,Agent général / Agente générale d'assurances,Analyste de crédits et risques bancaires,Analyste engagements bancaires,Analyste prêt bancaire,Assistant / Assistante de clientèle de banque,Assistant / Assistante service clientèle de banque,Assistant / Assistante service clientèle bancaire,Attaché commercial / Attachée commerciale bancaire entreprise,Attaché commercial / Attachée commerciale bancaire financements spécialisés,Attaché commercial / Attachée commerciale banque d'affaires,Attaché / Attachée de clientèle de banque,Attaché / Attachée de clientèle en assurances,Attaché / Attachée risques bancaires,Autorisateur / Autorisatrice en assurances,Caissier / Caissière de bureau de change,Chargé / Chargée d'accueil en banque,Chargé / Chargée d'accueil et de services clientèle bancaire,Chargé / Chargée d'affaires bancaires commerce international,Chargé / Chargée d'affaires bancaires entreprise,Chargé / Chargée d'affaires bancaires professionnelles,Chargé / Chargée de back-office,Chargé / Chargée de clientèle bancaire,Chargé / Chargée de clientèle bancaire grandes entreprises,Chargé / Chargée de clientèle centre d'appels en assurances,Chargé / Chargée de clientèle commerciale de banque,Chargé / Chargée de clientèle de banque,Chargé / Chargée de clientèle en assurances,Chargé / Chargée de clientèle entreprises de banque,Chargé / Chargée de clientèle particuliers de banque,Chargé / Chargée de clientèle professionnelle de banque,Chargé / Chargée de comptes Incendie, Accidents, Risques Divers -IARD-,Chargé / Chargée de comptes bancaires professionnels,Chargé / Chargée de développement clientèle bancaire entreprise,Chargé / Chargée de gestion bancaire,Chargé / Chargée de relations clientèle bancaire,Chargé / Chargée d'études crédits bancaires,Chargé / Chargée d'études actuarielles en assurances,Chargé / Chargée d'études actuarielles gestion actif - passif,Chargé / Chargée d'études techniques en assurances,Chargé / Chargée d'indemnisations en assurances,Collaborateur commercial / Collaboratrice commerciale en assurances,Conseiller / Conseillère accueil en agence bancaire,Conseiller / Conseillère clientèle en assurances,Conseiller commercial / Conseillère commerciale en assurances,Conseiller commercial professionnel / Conseillère commerciale professionnelle secteur bancaire,Conseiller / Conseillère d'accueil en banque,Conseiller / Conseillère de clientèle bancaire,Conseiller / Conseillère en assurances,Conseiller / Conseillère en assurance produits d'épargne,Conseiller / Conseillère en assurance vie,Conseiller / Conseillère en développement de patrimoine,Conseiller / Conseillère en gestion de capitaux,Conseiller / Conseillère en gestion de fortune,Conseiller / Conseillère en gestion de patrimoine financier,Conseiller / Conseillère en investissements financiers,Conseiller / Conseillère en investissements privés,Conseiller / Conseillère en patrimoine financier,Conseiller / Conseillère en produit épargne,Conseiller financier / Conseillère financière banque postale,Conseiller financier / Conseillère financière clientèle professionnelle,Conseiller / Conseillère gestion banque privée,Conseiller / Conseillère gestion sinistres,Conseiller / Conseillère Incendie, Accidents, Risques Divers -IARD-,Conseiller / Conseillère mutualiste,Conseiller / Conseillère mutualiste Incendie, Accidents, Risques Divers -IARD-,Conseiller / Conseillère prévoyance santé,Contrôleur / Contrôleuse de sécurité des services prévention de la Sécurité Sociale,Courtier / Courtière en assurances,Décompteur / Décompteuse de prestations,Directeur / Directrice des risques bancaires,Directeur / Directrice technique en actuariat,Enquêteur / Enquêtrice assurance maladie,Expert / Experte back-office,Expert / Experte en assurances dommages,Expert / Experte en assurances dommages et responsabilité civile,Expert / Experte en règlement de sinistres en assurances,Expert évaluateur / Experte évaluatrice en assurances,Expert / Experte middle-office,Expert / Experte risques en assurances,Gestionnaire actif-passif en assurances,Gestionnaire compte entreprise en assurances,Gestionnaire cotisations en assurances,Gestionnaire de clientèle bancaire,Gestionnaire de compte retraite en assurances,Gestionnaire de fortune,Gestionnaire de middle-office,Gestionnaire de patrimoine financier,Gestionnaire des opérations sur les marchés financiers,Gestionnaire en assurances,Gestionnaire engagements bancaires,Gestionnaire liquidation retraite,Gestionnaire prestations en assurances,Gestionnaire risques bancaires,Gestionnaire santé en assurances,Gestionnaire sinistre Incendie, Accidents, Risques Divers -IARD-,Guichetier / Guichetière accueil banque,Guichetier / Guichetière de banque,Guichetier / Guichetière de la banque postale,Guichetier payeur / Guichetière payeuse,Guichetier vendeur / Guichetière vendeuse,Ingénieur financier / Ingénieure financière en crédit bancaire,Ingénieur-conseil / Ingénieure-conseil des services prévention de la Sécurité Sociale,Inspecteur enquêteur / Inspectrice enquêtrice d'assurances,Inspecteur indemnisateur / Inspectrice indemnisatrice en assurances,Inspecteur régleur / Inspectrice régleuse d'assurances,Inspecteur / Inspectrice risques en assurances,Inspecteur / Inspectrice risques professionnels et prévention en assurances,Inspecteur / Inspectrice technique d'assurances,Inspecteur-vérificateur / Inspectrice-vérificatrice en assurances,Liquidateur / Liquidatrice de prestations,Opérateur / Opératrice back-office,Opérateur / Opératrice middle-office,Producteur / Productrice en assurances,Rédacteur / Rédactrice crédits bancaires,Rédacteur / Rédactrice d'assurances,Rédacteur polyvalent / Rédactrice polyvalente production sinistres,Rédacteur / Rédactrice production auto,Rédacteur / Rédactrice production Incendie Risques Industriels (IRI),Rédacteur / Rédactrice production risques complexes,Rédacteur / Rédactrice production risques de particuliers,Rédacteur / Rédactrice production Risques Divers (RD),Rédacteur / Rédactrice production risques simples,Rédacteur / Rédactrice production vie,Rédacteur / Rédactrice règlement assurances,Rédacteur / Rédactrice règlement automatique,Rédacteur / Rédactrice règlement contentieux,Rédacteur / Rédactrice règlement corporel,Rédacteur / Rédactrice règlement incendie dommage,Rédacteur / Rédactrice règlement matériel auto,Rédacteur / Rédactrice règlement responsabilité civile,Rédacteur / Rédactrice sinistre auto,Rédacteur / Rédactrice sinistre incendie,Rédacteur / Rédactrice sinistres,Rédacteur / Rédactrice sinistres complexes,Rédacteur / Rédactrice sinistres contentieux,Rédacteur / Rédactrice sinistres risques divers,Rédacteur / Rédactrice sinistres simples,Responsable clientèle bancaire entreprise,Responsable crédit,Responsable de back-office,Responsable de middle-office,Responsable de souscription en assurances,Responsable d'inspection en assurances,Responsable grands comptes bancaires,Souscripteur / Souscriptrice assurance collective,Souscripteur / Souscriptrice en assurances,Souscripteur / Souscriptrice Incendie, Accidents, Risques Divers -IARD-,Souscripteur / Souscriptrice responsabilité civile en assurances,Souscripteur / Souscriptrice vie collective en assurances,Souscripteur / Souscriptrice vie en assurances,Souscripteur-autorisateur / Souscriptrice-autorisatrice en assurances,Technicien / Technicienne d'actuariat,Technico-commercial / Technico-commerciale en assurances,Téléconseiller / Téléconseillère en assurances,Téléconseiller / Téléconseillère en banque,Mandataire en assurances,Analyste Know Your Customer - KYC,Chargé / Chargée de clientèle rachat de crédits,Gestionnaire de prestations assurance maladie,Gestionnaire de comptes cotisants,Gestionnaire de prestations sociales,Conseiller / Conseillère en crédit immobilier,Courtier / Courtière en prêts immobiliers,Expert / Experte à distance sinistres et dommages en assurances
