Fap87;libelle_appellation_long
A0Z;Accouveur / Accouveuse,Agent chargé / Agente chargée de protection et de sauvegarde du patrimoine naturel,Agent / Agente de maîtrise d'exploitation forestière,Agent / Agente technique des parcs nationaux,Agent technique forestier / Agente technique forestière,Agriculteur / Agricultrice,Agriculteur / Agricultrice de production laitière,Agriculteur / Agricultrice en polyculture,Aide agricole en production laitière,Aide de conchyliculture,Aide de pisciculture,Aide d'élevage aquacole,Aide d'élevage bovin,Aide d'élevage caprin,Aide d'élevage cunicole (lapins),Aide d'élevage de chevaux,Aide d'élevage en production de volaille,Aide d'élevage en production laitière,Aide d'élevage ostréicole,Aide d'élevage ovin,Aide d'élevage porcin,Aide-vacher / Aide-vachère,Ânier / Ânière,Animalier / Animalière de laboratoire,Animalier / Animalière en parc zoologique,Apiculteur / Apicultrice,Arboriste,Arboriste grimpeur / grimpeuse,Aviculteur / Avicultrice,Berger / Bergère,Berger / Bergère de production laitière,Berger / Bergère d'estives,Berger fromager / Bergère fromagère,Betteravier / Betteravière,Bouvier / Bouvière,Bûcheron / Bûcheronne,Bûcheron élagueur / Bûcheronne élagueuse,Céréalier / Céréalière,Charbonnier / Charbonnière,Chauffeur / Chauffeuse de machines agricoles,Chef de culture céréalière,Chef de district forestier,Chef de production agricole,Chef de production agricole porcine,Chef d'élevage porcin,Chef d'équipe d'exploitation agricole,Chef d'équipe en polyculture élevage,Chef d'exploitation agricole,Chef d'exploitation agricole porcine,Chevrier / Chevrière,Chevrier fromager / Chevrière fromagère,Commis / Commise de coupe,Conducteur / Conductrice d'abatteuses,Conducteur / Conductrice d'atelier de production animale bovine ou équine,Conducteur / Conductrice d'atelier de production animale porcine,Conducteur / Conductrice d'atelier de vaches allaitantes,Conducteur / Conductrice de tête d'abattage,Conducteur / Conductrice de tracteur,Conducteur / Conductrice de machines à vendanger,Conducteur / Conductrice d'engins de débardage,Conducteur / Conductrice d'engins d'exploitation agricole,Conducteur / Conductrice d'engins d'exploitation forestière,Conducteur / Conductrice d'engins forestiers,Contremaître / Contremaîtresse agricole,Contremaître / Contremaîtresse d'exploitation agricole,Contremaître / Contremaîtresse d'exploitation forestière,Coturniculteur / Coturnicultrice (cailles),Cultivateur / Cultivatrice de grandes cultures,Cultivateur / Cultivatrice de plein champ,Cyniculteur / Cynicultrice (gibiers),Débardeur / Débardeuse,Débardeur forestier / Débardeuse forestière,Dresseur / Dresseuse de chiens,Eco garde,Éhouppeur / Éhouppeuse,Élagueur / Élagueuse,Élagueur / Élagueuse espaces verts,Élagueur-botteur / Élagueuse-botteuse,Élagueur-grimpeur / Élagueuse-grimpeuse,Éleveur / Éleveuse d'agneaux,Éleveur / Éleveuse d'ânes,Éleveur / Éleveuse d'animaux à fourrure,Éleveur / Éleveuse d'animaux de compagnie,Éleveur / Éleveuse d'autruches,Éleveur / Éleveuse de bisons,Éleveur / Éleveuse de bovins,Éleveur / Éleveuse de brebis laitières,Éleveur / Éleveuse de caprins,Éleveur / Éleveuse de cervidés,Éleveur / Éleveuse de chats,Éleveur / Éleveuse de chevaux,Éleveur / Éleveuse de chèvres,Éleveur / Éleveuse de chèvres angoras,Éleveur / Éleveuse de chiens,Éleveur / Éleveuse de chiens guides,Éleveur / Éleveuse de crocodiles,Éleveur / Éleveuse de grands gibiers,Éleveur / Éleveuse de lamas,Éleveur / Éleveuse de lapins,Éleveur / Éleveuse de lapins angoras,Éleveur / Éleveuse de lapins ou de volailles,Éleveur / Éleveuse de moutons,Éleveur / Éleveuse de petits gibiers,Éleveur / Éleveuse de poneys,Éleveur / Éleveuse de porcins,Éleveur / Éleveuse de porcs,Éleveur / Éleveuse de poulains,Éleveur / Éleveuse de reptiles,Éleveur / Éleveuse de reptiles aquatiques,Éleveur / Éleveuse de rongeurs,Éleveur / Éleveuse de taurillons,Éleveur / Éleveuse de vaches laitières,Éleveur / Éleveuse de vaches laitières et de bétail viande,Éleveur / Éleveuse de veaux de boucherie,Éleveur / Éleveuse de visons,Éleveur / Éleveuse de volailles,Éleveur / Éleveuse d'escargots,Éleveur / Éleveuse d'insectes,Éleveur / Éleveuse d'ovins,Éleveur / Éleveuse en production bovine et/ou équine,Éleveur / Éleveuse en production ovine et caprine,Éleveur / Éleveuse en production porcine,Éleveur laitier / Éleveuse laitière en production ovine et caprine,Éleveur-sélectionneur / Éleveuse-sélectionneuse d'ovins et de caprins,Éleveur-sélectionneur / Éleveuse-sélectionneuse en production bovine et/ou équine,Éleveur-sélectionneur / Éleveuse-sélectionneuse en production de lapins,Éleveur-sélectionneur / Éleveuse-sélectionneuse en production de volailles,Éleveur-sélectionneur / Éleveuse-sélectionneuse en production porcine,Engraisseur / Engraisseuse de lapins ou de volailles,Engraisseur / Engraisseuse de porcelets,Étalonnier / Étalonnière,Exploitant / Exploitante agricole,Exploitant forestier / Exploitante forestière,Féliniculteur / Félinicultrice (félins),Forestier / Forestière,Garçon / Fille de chenil,Garde de parc naturel,Garde du littoral,Garde forestier / forestière,Garde moniteur / monitrice de parc national,Garde moniteur / monitrice de parc naturel,Garde national / nationale de la chasse et de la faune sauvage,Garde technicien / technicienne de réserve naturelle,Garde-chasse,Garde-chasse particulier / particulière,Garde-pêche,Garde-rivière,Gardian,Gaveur / Gaveuse,Gérant / Gérante d'exploitation agricole,Grimpeur-élagueur / Grimpeuse-élagueuse,Héliciculteur / Hélicicultrice (escargots),Intendant / Intendante d'exploitation agricole,Lombriculteur / Lombricultrice (lombrics),Maïsiculteur / Maïsicultrice,Manadier / Manadière,Manoeuvre forestier / forestière,Moutonnier / Moutonnière,Naisseur / Naisseuse en production de lapins ou de volailles,Naisseur-engraisseur / Naisseuse-engraisseuse porcin,Opérateur / Opératrice d'abatteuse,Ouvrier / Ouvrière agricole de grandes cultures,Ouvrier / Ouvrière agricole en production bovine,Ouvrier / Ouvrière agricole en production caprine,Ouvrier / Ouvrière agricole en production de lapins,Ouvrier / Ouvrière agricole en production de volailles,Ouvrier / Ouvrière agricole en production équine,Ouvrier / Ouvrière agricole en production laitière,Ouvrier / Ouvrière agricole en production laitière d'ovins ou de caprins,Ouvrier / Ouvrière agricole en production ovine,Ouvrier / Ouvrière agricole en production porcine,Ouvrier agricole polyvalent / Ouvrière agricole polyvalente,Ouvrier agricole polyvalent / Ouvrière agricole polyvalente en élevage porcin,Ouvrier / Ouvrière agricole spécialisation aviculture,Ouvrier / Ouvrière avicole,Ouvrier / Ouvrière cunicole (lapins),Ouvrier / Ouvrière cynicole,Ouvrier / Ouvrière d'accouvage,Ouvrier / Ouvrière de production bovine,Ouvrier / Ouvrière de production ovine,Ouvrier / Ouvrière de production porcine,Ouvrier / Ouvrière d'élevage en production bovine,Ouvrier / Ouvrière d'élevage en production bovine biologique,Ouvrier / Ouvrière d'élevage en production caprine,Ouvrier / Ouvrière d'élevage en production de lapins,Ouvrier / Ouvrière d'élevage en production de volailles,Ouvrier / Ouvrière d'élevage en production équine,Ouvrier / Ouvrière d'élevage en production ovine,Ouvrier / Ouvrière d'élevage en production porcine,Ouvrier / Ouvrière d'élevage laitier bovin,Ouvrier / Ouvrière d'élevage laitier en production ovine ou caprine,Ouvrier / Ouvrière d'exploitation forestière,Ouvrier / Ouvrière en polyculture élevage,Ouvrier forestier / Ouvrière forestière,Ouvrier sylvicole / Ouvrière sylvicole,Ouvrier sylviculteur / Ouvrière sylvicultrice,Palefrenier / Palefrenière,Pilote de machines d'abattage,Polyculteur éleveur / Polycultrice éleveuse,Populiculteur / Populicultrice,Porcher / Porchère,Producteur / Productrice de cannes à sucre,Producteur / Productrice de lait bovin,Producteur / Productrice de lait d'ovin et de caprin,Producteur / Productrice de pommes de terre,Producteur / Productrice de protéagineux,Producteur / Productrice de viande bovine,Producteur / Productrice de viande équine,Producteur / Productrice d'oléagineux,Producteur / Productrice hors sol porcin,Ramasseur / Ramasseuse de volaille,Ramasseur / Ramasseuse d'oeufs,Raniculteur / Ranicultrice (grenouilles),Régisseur / Régisseuse d'exploitation agricole,Régisseur / Régisseuse d'exploitation agricole porcine,Régisseur / Régisseuse en agriculture,Régisseur / Régisseuse en agriculture porcine,Régisseur / Régisseuse polyculture élevage porcin,Responsable de poulailler,Responsable de troupeau,Responsable d'élevage avicole,Responsable d'élevage bovin,Responsable d'élevage cunicole (lapins),Responsable d'élevage en production caprine,Responsable d'élevage en production ovine,Responsable d'élevage équin,Responsable d'élevage porcin,Riziculteur / Rizicultrice,Second / Seconde d'exploitation en polyculture élevage,Second / Seconde d'exploitation porcine,Sériciculteur / Séricicultrice (vers à soie),Sexeur / Sexeuse de volailles,Sylviculteur / Sylvicultrice,Technicien / Technicienne cynégétique,Technicien spécialisé / Technicienne spécialisée en conduite d'élevage porcin,Tondeur / Tondeuse de moutons,Tractoriste agricole,Tractoriste forestier / Tractoriste forestière,Vacher / Vachère,Zootechnicien / Zootechnicienne,Technicien / Technicienne de rivière,Homme / Femme de pied,Chef d'équipe de travaux forestiers,Conducteur / Conductrice de travaux forestiers,Éducateur / Éducatrice canin,Conducteur / Conductrice d'automoteur de récolte,Conducteur / Conductrice de pulvérisateur,Opérateur / Opératrice d'épandage,Conducteur / Conductrice d'épareuse,Conducteur / Conductrice de matériels de semis,Conducteur / Conductrice de tracto-benne,Chef de chantier de travaux agricoles,Conducteur / Conductrice de travaux en entreprise de travaux agricoles,Conducteur / Conductrice de tracteur enjambeur,Polyéleveur / Polyéleveuse,Observateur / Observatrice des pêches
A1Z;Agent / Agente d'aménagement des circuits pédestres, équestres et Vtt,Agent / Agente d'aménagement des haies et fossés,Agent / Agente d'entretien de la nature,Agent / Agente d'entretien de l'espace rural,Agent / Agente d'entretien des espaces naturels,Agent / Agente d'entretien des parcs et jardins,Agent / Agente d'entretien des rivières,Agent / Agente d'entretien nature du littoral,Agréé / Agréée en architecture,Aide agricole en arboriculture,Aide agricole en maraîchage-horticulture,Aide agricole en polyculture,Aide agricole en production florale,Aide agricole en production fruitière,Aide agricole en production légumière,Aide agricole en production végétale,Aide agricole en viticulture,Aide arboricole,Aide horticole,Aide maraîcher / maraîchère,Aide viticole,Aide-arboriculteur / Aide-arboricultrice,Aide-pépiniériste,Aide-viticulteur / Aide-viticultrice,Arboriculteur / Arboricultrice,Arboriculteur ornemental / Arboricultrice ornementale,Architecte,Architecte conseiller / conseillère,Architecte consultant / consultante,Architecte des monuments de France,Architecte du bâtiment,Architecte paysagiste,Architecte paysagiste urbain / urbaine,Architecteur / Architecteure,Architecte-urbaniste,Aspigiculteur / Aspigicultrice,Bulbiculteur / Bulbicultrice,Castreur / Castreuse de maïs,Champignonniste,Chef de culture arboricole,Chef de culture champignonniste,Chef de culture en exploitation maraîchère,Chef de culture floriculture,Chef de culture horticole,Chef de culture maraîchère,Chef de culture pépinière,Chef de culture viticole,Chef de station fruitière,Chef d'équipe d'entretien des espaces verts,Chef d'équipe d'entretien d'espaces naturels,Chef d'équipe paysagiste,Chef d'exploitation en arboriculture,Chef d'exploitation en maraîchage-horticulture,Conducteur / Conductrice de travaux horticoles,Contremaître / Contremaîtresse en arboriculture,Coupeur / Coupeuse de canne à sucre,Cressiculteur / Cressicultrice,Cueilleur / Cueilleuse de cerises,Cueilleur / Cueilleuse de feuilles de tabac,Cueilleur / Cueilleuse de fruits,Cueilleur / Cueilleuse de pêches,Cueilleur / Cueilleuse de poires,Cueilleur / Cueilleuse de pommes,Cultivateur / Cultivatrice de primeurs,Cultivateur / Cultivatrice d'endives,Directeur / Directrice des cultures,Endivier / Endivière,Floriculteur / Floricultrice,Fruiticulteur / Fruiticultrice,Horticulteur / Horticultrice,Jardinier / Jardinière,Jardinier / Jardinière d'espaces verts,Jardinier / Jardinière paysagiste,Kiwiculteur / Kiwicultrice,Lavandiculteur / Lavandicultrice,Maraîcher / Maraîchère,Oléiculteur / Oléicultrice,Osiériculteur / Osiéricultrice,Ouvrier / Ouvrière agricole en maraîchage-horticulture,Ouvrier / Ouvrière arboricole,Ouvrier / Ouvrière champignonniste,Ouvrier / Ouvrière de champignonnière,Ouvrier / Ouvrière de culture maraîchère,Ouvrier / Ouvrière d'entretien des espaces naturels,Ouvrier / Ouvrière d'entretien des espaces verts,Ouvrier / Ouvrière des espaces verts,Ouvrier / Ouvrière du paysage,Ouvrier / Ouvrière en arboriculture,Ouvrier / Ouvrière en production horticole biologique,Ouvrier / Ouvrière en production maraîchère biologique,Ouvrier / Ouvrière en production pépinière biologique,Ouvrier / Ouvrière en viticulture,Ouvrier / Ouvrière horticole,Ouvrier / Ouvrière horticole serriste,Ouvrier maraîcher / Ouvrière maraîchère,Ouvrier maraîcher / Ouvrière maraîchère de culture légumière,Ouvrier maraîcher / Ouvrière maraîchère primeuriste,Ouvrier / Ouvrière paysagiste,Ouvrier / Ouvrière pépiniériste,Ouvrier / Ouvrière serriste,Ouvrier viticole / Ouvrière viticole,Pépiniériste,Pépiniériste viticole,Planteur / Planteuse de bananes,Planteur / Planteuse de café - thé,Planteur / Planteuse de canne à sucre,Planteur / Planteuse de tabac,Pomiculteur / Pomicultrice,Porteur / Porteuse de hottes,Primeuriste,Producteur / Productrice d'ananas,Producteur / Productrice de bananes,Producteur / Productrice de plantes à parfum,Producteur / Productrice de plantes aromatiques,Producteur / Productrice de plantes in vitro,Producteur / Productrice de plantes médicinales,Producteur / Productrice de semences,Producteur / Productrice de tabac,Producteur / Productrice de tomates,Pruniculteur / Prunicultrice,Ramasseur / Ramasseuse d'ail,Ramasseur / Ramasseuse d'asperges,Ramasseur / Ramasseuse de champignons,Ramasseur / Ramasseuse de légumes,Ramasseur / Ramasseuse de pommes de terre,Ramasseur / Ramasseuse d'endives,Régisseur / Régisseuse d'exploitation viticole,Responsable de champignonnière,Responsable d'exploitation viticole,Rosiériste,Second / Seconde d'exploitation horticole,Semencier / Semencière,Serriste,Tabaculteur / Tabacultrice,Tailleur / Tailleuse de vigne,Vendangeur / Vendangeuse,Vigneron manipulant / Vigneronne manipulante,Viticulteur / Viticultrice,Technicien / Technicienne paysagiste,Tailleur / Tailleuse de fruitiers,Agent / Agente d'entretien nature et biodiversité,Aide jardinier / jardinière,Manoeuvre des espaces verts,Chef d'équipe en production maraîchère,Chef d'équipe en production arboricole,Concepteur / Conceptrice paysagiste,Ouvrier / Ouvrière de génie écologique
A2Z;Agent / Agente de collecte d'embryons,Agent / Agente de collecte d'embryons,Agent / Agente de production laitière,Agent / Agente de production laitière,Agent / Agente sanitaire apicole,Agent / Agente sanitaire apicole,Agent / Agente sanitaire de l'agriculture,Agent / Agente sanitaire de l'agriculture,Agent / Agente technique agricole,Agent / Agente technique agricole,Agent / Agente technique d'élevage,Agent / Agente technique d'élevage,Agent / Agente technique en produits de traitement,Agent / Agente technique en produits de traitement,Agriculteur / Agricultrice,Agriculteur / Agricultrice en polyculture,Agro-économiste,Agro-économiste,Animateur / Animatrice agricole,Animateur / Animatrice agricole,Animateur / Animatrice d'organismes agricoles,Animateur / Animatrice d'organismes agricoles,Assistant / Assistante sanitaire apicole,Assistant / Assistante sanitaire apicole,Betteravier / Betteravière,Bio-ingénieur / Bio-ingénieure,Bio-ingénieur / Bio-ingénieure,Céréalier / Céréalière,Chargé / Chargée de mission en agriculture,Chargé / Chargée de mission en agriculture,Chargé / Chargée de recherche en agriculture,Chargé / Chargée de recherche en agriculture,Chargé / Chargée d'études agricoles,Chargé / Chargée d'études agricoles,Chargé / Chargée d'études économiques en agriculture,Chargé / Chargée d'études économiques en agriculture,Chargé / Chargée d'études en développement agricole,Chargé / Chargée d'études en développement agricole,Chargé / Chargée d'études en développement rural,Chargé / Chargée d'études en développement rural,Chargé / Chargée d'études environnement,Chargé / Chargée d'études environnement,Chef de culture céréalière,Chef de production agricole,Chef d'équipe d'exploitation agricole,Chef d'équipe en polyculture élevage,Chef d'exploitation agricole,Conseiller / Conseillère agricole,Conseiller / Conseillère agricole,Conseiller / Conseillère d'agriculture,Conseiller / Conseillère d'agriculture,Conseiller / Conseillère de gestion agricole,Conseiller / Conseillère de gestion agricole,Conseiller / Conseillère d'élevage en production laitière,Conseiller / Conseillère d'élevage en production laitière,Conseiller / Conseillère en irrigation,Conseiller / Conseillère en irrigation,Conseiller / Conseillère en machinisme agricole,Conseiller / Conseillère en machinisme agricole,Conseiller forestier / Conseillère forestière,Conseiller forestier / Conseillère forestière,Conseiller / Conseillère technique agricole,Conseiller / Conseillère technique agricole,Conseiller / Conseillère viticole,Conseiller / Conseillère viticole,Contremaître / Contremaîtresse agricole,Contremaître / Contremaîtresse d'exploitation agricole,Contrôleur / Contrôleuse de croissance de l'agriculture,Contrôleur / Contrôleuse de croissance de l'agriculture,Contrôleur / Contrôleuse de culture,Contrôleur / Contrôleuse de culture,Contrôleur / Contrôleuse de performance,Contrôleur / Contrôleuse de performance,Contrôleur laitier / Contrôleuse laitière,Contrôleur laitier / Contrôleuse laitière,Contrôleur / Contrôleuse viticole,Contrôleur / Contrôleuse viticole,Contrôleur-pointeur / Contrôleuse-pointeuse,Contrôleur-pointeur / Contrôleuse-pointeuse,Cultivateur / Cultivatrice de grandes cultures,Cultivateur / Cultivatrice de plein champ,Expérimentateur / Expérimentatrice en agriculture,Expérimentateur / Expérimentatrice en agriculture,Expert agricole et foncier / Experte agricole et foncière,Expert agricole et foncier / Experte agricole et foncière,Expert / Experte cynégétique,Expert / Experte cynégétique,Expert / Experte en aquaculture,Expert / Experte en aquaculture,Expert forestier / Experte forestière,Expert forestier / Experte forestière,Exploitant / Exploitante agricole,Gérant / Gérante d'exploitation agricole,Hydraulicien / Hydraulicienne en agriculture,Hydraulicien / Hydraulicienne en agriculture,Ingénieur / Ingénieure agro-environnement,Ingénieur / Ingénieure agro-environnement,Ingénieur / Ingénieure agro-halieute,Ingénieur / Ingénieure agro-halieute,Ingénieur / Ingénieure agronome,Ingénieur / Ingénieure agronome,Ingénieur / Ingénieure arboricole,Ingénieur / Ingénieure arboricole,Ingénieur / Ingénieure des eaux et forêts,Ingénieur / Ingénieure des eaux et forêts,Ingénieur / Ingénieure des techniques forestières,Ingénieur / Ingénieure des techniques forestières,Ingénieur / Ingénieure des travaux agricoles,Ingénieur / Ingénieure des travaux agricoles,Ingénieur / Ingénieure des travaux des eaux et forêts,Ingénieur / Ingénieure des travaux des eaux et forêts,Ingénieur / Ingénieure des travaux ruraux,Ingénieur / Ingénieure des travaux ruraux,Ingénieur / Ingénieure d'études et de recherche agricoles,Ingénieur / Ingénieure d'études et de recherche agricoles,Ingénieur / Ingénieure du génie rural,Ingénieur / Ingénieure du génie rural,Ingénieur / Ingénieure du génie rural des eaux et forêts -IGREF-,Ingénieur / Ingénieure du génie rural des eaux et forêts -IGREF-,Ingénieur / Ingénieure en expérimentation animale,Ingénieur / Ingénieure en expérimentation animale,Ingénieur / Ingénieure en expérimentation végétale,Ingénieur / Ingénieure en expérimentation végétale,Ingénieur / Ingénieure en techniques d'expérimentation animale,Ingénieur / Ingénieure en techniques d'expérimentation animale,Ingénieur / Ingénieure halieute,Ingénieur / Ingénieure halieute,Ingénieur / Ingénieure horticole,Ingénieur / Ingénieure horticole,Ingénieur / Ingénieure paysagiste,Ingénieur / Ingénieure paysagiste,Inséminateur artificiel / Inséminatrice artificielle,Inséminateur artificiel / Inséminatrice artificielle,Intendant / Intendante d'exploitation agricole,Maïsiculteur / Maïsicultrice,Ouvrier / Ouvrière agricole de grandes cultures,Ouvrier agricole polyvalent / Ouvrière agricole polyvalente,Ouvrier / Ouvrière en polyculture élevage,Peseur laitier / Peseuse laitière,Peseur laitier / Peseuse laitière,Polyculteur éleveur / Polycultrice éleveuse,Producteur / Productrice de cannes à sucre,Producteur / Productrice de pommes de terre,Producteur / Productrice de protéagineux,Producteur / Productrice d'oléagineux,Régisseur / Régisseuse d'exploitation agricole,Régisseur / Régisseuse en agriculture,Riziculteur / Rizicultrice,Second / Seconde d'exploitation en polyculture élevage,Technicien / Technicienne agricole,Technicien / Technicienne agricole,Technicien / Technicienne arboricole,Technicien / Technicienne arboricole,Technicien / Technicienne avicole,Technicien / Technicienne avicole,Technicien / Technicienne bâtiments d'élevage,Technicien / Technicienne bâtiments d'élevage,Technicien / Technicienne bovin,Technicien / Technicienne bovin,Technicien / Technicienne caprin,Technicien / Technicienne caprin,Technicien / Technicienne cunicole,Technicien / Technicienne cunicole,Technicien / Technicienne d'agriculture,Technicien / Technicienne d'agriculture,Technicien / Technicienne de contrôle de croissance de l'agriculture,Technicien / Technicienne de contrôle de croissance de l'agriculture,Technicien / Technicienne de contrôle laitier,Technicien / Technicienne de contrôle laitier,Technicien / Technicienne de culture maraîchère,Technicien / Technicienne de culture maraîchère,Technicien / Technicienne de maintenance végétale,Technicien / Technicienne de maintenance végétale,Technicien / Technicienne de production animale,Technicien / Technicienne de production animale,Technicien / Technicienne de production laitière,Technicien / Technicienne de production laitière,Technicien / Technicienne d'élevage,Technicien / Technicienne d'élevage,Technicien / Technicienne des services vétérinaires,Technicien / Technicienne des services vétérinaires,Technicien / Technicienne des travaux forestiers,Technicien / Technicienne des travaux forestiers,Technicien / Technicienne d'expérimentation,Technicien / Technicienne d'expérimentation,Technicien / Technicienne du génie rural,Technicien / Technicienne du génie rural,Technicien / Technicienne du génie sanitaire et environnement,Technicien / Technicienne du génie sanitaire et environnement,Technicien / Technicienne en agriculture biologique,Technicien / Technicienne en agriculture biologique,Technicien / Technicienne en alimentation animale,Technicien / Technicienne en alimentation animale,Technicien / Technicienne en fabrication fromagère,Technicien / Technicienne en fabrication fromagère,Technicien / Technicienne équin,Technicien / Technicienne équin,Technicien foncier / Technicienne foncière,Technicien foncier / Technicienne foncière,Technicien foncier / Technicienne foncière en agriculture,Technicien foncier / Technicienne foncière en agriculture,Technicien forestier / Technicienne forestière,Technicien forestier / Technicienne forestière,Technicien forestier / Technicienne forestière d'études et de recherche,Technicien forestier / Technicienne forestière d'études et de recherche,Technicien / Technicienne horticole,Technicien / Technicienne horticole,Technicien laitier / Technicienne laitière,Technicien laitier / Technicienne laitière,Technicien / Technicienne ovin,Technicien / Technicienne ovin,Technicien / Technicienne porcin,Technicien / Technicienne porcin,Technicien / Technicienne semences,Technicien / Technicienne semences,Technicien / Technicienne viticole,Technicien / Technicienne viticole,Conseiller / Conseillère en génie climatique agricole,Conseiller / Conseillère en génie climatique agricole,Chargé / Chargée de mission biodiversité,Chargé / Chargée de mission biodiversité,Chargé / Chargée d'études en biodiversité,Chargé / Chargée d'études en biodiversité,Chargé / Chargée d'études du patrimoine naturel,Chargé / Chargée d'études du patrimoine naturel,Chef de chantier de travaux agricoles,Conducteur / Conductrice de travaux en entreprise de travaux agricoles,Polyéleveur / Polyéleveuse,Ingénieur / Ingénieure écologue,Ingénieur / Ingénieure écologue,Ingénieur / Ingénieure méthanisation,Ingénieur / Ingénieure méthanisation,Technicien / Technicienne de génie écologique,Technicien / Technicienne de génie écologique
